{
  "topic": "다다미 치수 지역차 (京間·江戸間)",
  "candidates": [
    {
      "candidate": "01.json",
      "axes": {
        "hook_strength": {
          "score": 2,
          "why": "비판이 '가장 안 팔린다'던 규격 훅 그대로에, 지는 그림(겹친 방)은 8줄에야 나온다"
        },
        "info_density": {
          "score": 4,
          "why": "571자에 치수·면적·1間·법·하한선이 다 들어가고 겹침·격자 그림이 설명을 진다"
        },
        "standalone": {
          "score": 3,
          "why": "間·6조·畳割은 자체 설명되나 19줄은 제시된 적 없는 도식을 반박해 혼자 못 선다"
        }
      },
      "total": 9,
      "critique_reflected": [
        "비판이 '가장 정확하지만 가장 안 팔리는 훅'으로 지목한 국가규격 병기 각도를 첫 줄에 그대로 썼다",
        "'훅은 겹친 두 방 도형이 진다'는 조건 ⑥과 달리 첫 두 장면의 그림이 규격 문서라 3초 안에 감정이 안 생긴다",
        "뒤집을 통념이 없어 '규격=통일'이라는 일반 원칙 우회로에 기댄다는 지적이 첫 줄에 그대로 남았다",
        "다다미 그림의 단조로움 경고대로 5~9줄과 14~16줄이 같은 계열 평면·깔림 그림으로 연속된다",
        "秀吉·家康 배제, 규격 나열 컷, 1.62㎡ 압축, 도서관 회답 딜레마, 동서 도식 회피 등 조건 ①~⑤는 이행됐다"
      ]
    }
  ],
  "chosen": "01.json",
  "why_chosen": "후보가 하나뿐이라 비교에서 진 후보는 없고, 총점 9점의 근거가 곧 선발 사유다. 이 후보는 비판의 진행 조건을 거의 전부 이행했다 — 해법을 '1間 자체가 달랐다'로 확정했고, 秀吉 인과와 규격 나열을 전량 배제했으며, 딜레마 구간(15~18줄)을 도서관 회답의 계산·절단 부담으로 채웠고, 19줄에서 동서 이분 도식까지 스스로 피해 갔다. 본문 밀도와 그림의 설명 부담(겹친 방 도형, 어긋난 눈금, 격자에 끼우는 다다미)도 높다. 다만 훅만은 비판이 '가장 안 팔린다'고 명시한 규격 문서 각도를 그대로 세웠고, 이 소재의 유일한 승부수인 겹친 두 방 도형을 첫 3초가 아니라 8~9줄에 배치해 [1a]의 구성 의도 중 가장 중요한 첫 장면이 문장으로 실현되지 못했다. 감점의 대부분이 여기서 나온다.",
  "verdict": "pass"
}
