{
  "topic": "보베 대성당 붕괴",
  "candidates": [
    {
      "candidate": "01.json",
      "axes": {
        "hook_strength": {
          "score": 2,
          "why": "1행이 날짜·층수 나열로 시작해 통념 충돌은 5행까지 밀린다"
        },
        "info_density": {
          "score": 4,
          "why": "27줄 571자에 연도·수치가 촘촘하나 3·9행 등 숫자가 말로만 나열된다"
        },
        "standalone": {
          "score": 3,
          "why": "신랑·트랜셉트·볼트·베이가 설명 없이 1행부터 쏟아져 첫 대면 시청자가 막힌다"
        }
      },
      "total": 9,
      "critique_reflected": [
        "'피라미드보다 높다'는 클리셰 비교를 3행에 그대로 사용",
        "훅을 숫자에 걸지 말라는 조건을 어기고 146.6m·153m를 전면 배치",
        "생소어(성가대석·신랑·트랜셉트) 설명 부담을 해소하지 않고 그대로 노출",
        "해법 부재를 27행 '미완성이 곧 학습' 훈화로 착지시켜 비판이 경고한 결말 그대로"
      ]
    }
  ],
  "chosen": "01.json",
  "why_chosen": "단독 후보이므로 선발은 자동이나 점수는 기준을 따로 매겼다. 이긴 이유가 아니라 남은 이유에 가깝다 — 인과 사슬(탑 우선 결정 → 버팀 부재 → 붕괴 → 볼트 파손 → 신랑 자금 소멸 → 영구 미완 → 오늘의 보)은 27줄 내내 끊기지 않고 이어져 [1a]의 why_chosen이 약속한 '한 줄 인과'는 실제 문장으로 실현됐고, 그림 지시도 본문이 말하지 않는 것을 맡아 밀도를 지킨다. 반면 그 의도의 핵심인 '높이가 아니라 순서'라는 뒤집기가 5행에 가서야 나오고, 1~4행은 비판이 클리셰로 지목한 피라미드 비교와 순위·기간 정정에 소비된다. 첫 3초가 통념과 부딪히는 자리에 정작 통념 뒤집기가 없다는 것이 hook_strength 2점의 이유다. 인지도 0에서 출발하는 소재인데 1행부터 첨탑·종탑, 6행부터 볼트·베이가 무설명으로 등장하는 것도 standalone을 깎았고, 마지막 27행은 비판이 미리 경고한 '교훈조 훈화' 착지를 피하지 못했다.",
  "verdict": "pass"
}
